[
  {
    "id": "AR_Exchange_Rates",
    "title": "سعر الصرف وتحويل العملات",
    "url": "https://www.nbe.com.eg/NBE/E/#/AR/ExchangeRatesAndCurrencyConverter",
    "language": "ar",
    "content": "صفحة أسعار صرف العملات ومحول العملات في البنك الأهلي المصري. تعرض أسعار شراء وبيع العملات الأجنبية مقابل الجنيه المصري (بنكنوت وتحويل). تشمل الدولار الأمريكي واليورو والجنيه الإسترليني وعملات أخرى.",
    "metadata": {
      "source": "curated_document",
      "is_stub": true,
      "curated_version": "2026-08-17.1",
      "reviewed_at": "2026-08-17",
      "valid_until": "2026-09-17",
      "status": "approved",
      "doc_type": "exchange_rate",
      "category": "exchange_rates",
      "canonical_url_slug": "ExchangeRatesAndCurrencyConverter"
    }
  },
  {
    "id": "EN_Exchange_Rates",
    "title": "Exchange Rates And Currency Converter",
    "url": "https://www.nbe.com.eg/NBE/E/#/EN/ExchangeRatesAndCurrencyConverter",
    "language": "en",
    "content": "NBE exchange rates and currency converter page. Shows buy and sell rates for foreign currencies against the Egyptian pound (banknote and transfer rates). Includes USD, EUR, GBP and other currencies.",
    "metadata": {
      "source": "curated_document",
      "is_stub": true,
      "curated_version": "2026-08-17.1",
      "reviewed_at": "2026-08-17",
      "valid_until": "2026-09-17",
      "status": "approved",
      "doc_type": "exchange_rate",
      "category": "exchange_rates",
      "canonical_url_slug": "ExchangeRatesAndCurrencyConverter"
    }
  },
  {
    "id": "AR_Belady_1Y_Category",
    "title": "شهادات بلادي سنة",
    "url": "https://www.nbe.com.eg/NBE/E/#/AR/ProductCategory?inParams={\"CategoryID\":\"beladyoneyear\"}",
    "language": "ar",
    "content": "شهادات بلادي سنة من البنك الأهلي المصري. المنتجات المتاحة تشمل: بلادي باليورو (الحد الأدنى 100 يورو، مدة سنة، عائد ثابت)، بلادي بالجنيه الاسترليني (الحد الأدنى 100 جنيه استرليني، مدة سنة)، بلادي بالدولار الأسترالي (الحد الأدنى 100 دولار أسترالي، مدة سنة). تصدر للأفراد المصريين المقيمين بالخارج ولأبنائهم القصر. بلادي بالدولار الأمريكي مذكورة في قائمة منتجات البنك؛ صفحة التفاصيل المباشرة قد لا تعرض محتوى حالياً على الموقع.",
    "metadata": {
      "source": "curated_document",
      "is_stub": true,
      "curated_version": "2026-08-17.1",
      "reviewed_at": "2026-08-17",
      "valid_until": "2026-09-17",
      "status": "approved",
      "doc_type": "certificate",
      "category": "certificates"
    }
  },
  {
    "id": "AR_Belady_USD_Rates",
    "title": "أسعار الشهادات بالعملة الأجنبية",
    "url": "https://www.nbe.com.eg/NBE/E/#/AR/CertificatesRatesForeignCurrency",
    "language": "ar",
    "content": "صفحة أسعار الشهادات بالعملة الأجنبية في البنك الأهلي المصري. تتضمن معلومات عن شهادات بلادي وشهادات أخرى بالعملات الأجنبية بما فيها الدولار الأمريكي. للاطلاع على العائد وشروط الاشتراك الحالية راجع هذه الصفحة أو تواصل مع أقرب فرع.",
    "metadata": {
      "source": "curated_document",
      "is_stub": true,
      "curated_version": "2026-08-17.1",
      "reviewed_at": "2026-08-17",
      "valid_until": "2026-09-17",
      "status": "approved",
      "doc_type": "certificate_rate",
      "category": "certificates"
    }
  },
  {
    "id": "AR_Belady_3Y_Category",
    "title": "شهادات بلادي 3 سنوات",
    "url": "https://www.nbe.com.eg/NBE/E/#/AR/ProductCategory?inParams={\"CategoryID\":\"beladythreeyears\"}",
    "language": "ar",
    "content": "شهادات بلادي 3 سنوات من البنك الأهلي المصري بالعملات الأجنبية، بما فيها فئات بالدولار الأمريكي واليورو والجنيه الاسترليني. للتفاصيل والعائد راجع صفحة فئة شهادات بلادي 3 سنوات على موقع البنك.",
    "metadata": {
      "source": "curated_document",
      "is_stub": true,
      "curated_version": "2026-08-17.1",
      "reviewed_at": "2026-08-17",
      "valid_until": "2026-09-17",
      "status": "approved",
      "doc_type": "certificate",
      "category": "certificates"
    }
  },
  {
    "id": "AR_Belady_5Y_Category",
    "title": "شهادات بلادي 5 سنوات",
    "url": "https://www.nbe.com.eg/NBE/E/#/AR/ProductCategory?inParams={\"CategoryID\":\"beladyfiveyears\"}",
    "language": "ar",
    "content": "شهادات بلادي 5 سنوات من البنك الأهلي المصري بالعملات الأجنبية، بما فيها فئات بالدولار الأمريكي واليورو والجنيه الاسترليني. للتفاصيل والعائد راجع صفحة فئة شهادات بلادي 5 سنوات على موقع البنك.",
    "metadata": {
      "source": "curated_document",
      "is_stub": true,
      "curated_version": "2026-08-17.1",
      "reviewed_at": "2026-08-17",
      "valid_until": "2026-09-17",
      "status": "approved",
      "doc_type": "certificate",
      "category": "certificates"
    }
  },
  {
    "id": "AR_Purchase_Certificate",
    "title": "شراء شهادة",
    "url": "https://www.nbe.com.eg/NBE/E/#/AR/ProductCategory?inParams={\"CategoryID\":\"BeladyCertificateID\"}",
    "language": "ar",
    "content": "شراء شهادة من البنك الأهلي المصري. تتوفر شهادات ادخار متعددة: شهادات بلادي (سنة، 3 سنوات، 5 سنوات) بالعملات الأجنبية، شهادات بالعملة المحلية، شهادات بالعملة الأجنبية، وشهادات الاستثمار. يمكن الاطلاع على تفاصيل كل شهادة وشرائها عبر موقع البنك الأهلي أو زيارة أقرب فرع. خدمة شراء شهادة متاحة ضمن الخدمات الذاتية على الموقع.",
    "metadata": {
      "source": "curated_document",
      "is_stub": true,
      "curated_version": "2026-08-17.1",
      "reviewed_at": "2026-08-17",
      "valid_until": "2026-09-17",
      "status": "approved",
      "doc_type": "certificate",
      "category": "certificates"
    }
  },
  {
    "id": "AR_Certificates_Overview",
    "title": "شهادات الادخار",
    "url": "https://www.nbe.com.eg/NBE/E/#/AR/ProductCategory?inParams={\"CategoryID\":\"CertificatesID\"}",
    "language": "ar",
    "content": "شهادات الادخار في البنك الأهلي المصري تشمل شهادات بلادي وشهادات بالعملة المحلية والأجنبية وشهادات الاستثمار. للشراء أو الاشتراك راجع صفحة الشهادات على موقع البنك أو تواصل مع الفرع الأقرب.",
    "metadata": {
      "source": "curated_document",
      "is_stub": true,
      "curated_version": "2026-08-17.1",
      "reviewed_at": "2026-08-17",
      "valid_until": "2026-09-17",
      "status": "approved",
      "doc_type": "certificate",
      "category": "certificates"
    }
  },
  {
    "id": "AR_Local_Certificates_Rates_Guidance",
    "title": "شهادات الادخار بالعملة المحلية",
    "url": "https://www.nbe.com.eg/NBE/E/#/AR/ProductCategory?inParams={\"CategoryID\":\"CertificatesID\"}",
    "language": "ar",
    "content": "مرجع مُراجع لصفحة شهادات الادخار بالعملة المحلية. يجب استخدام نسب العائد والشروط من أحدث مستند رسمي مسترجع فقط، وعدم ذكر أي نسبة لا تظهر صراحة في المصدر.",
    "metadata": {
      "source": "curated_document",
      "is_stub": true,
      "curated_version": "2026-08-17.1",
      "reviewed_at": "2026-08-17",
      "valid_until": "2026-09-17",
      "status": "approved",
      "doc_type": "certificate_rate",
      "category": "certificates"
    }
  },
  {
    "id": "EN_Local_Certificates_Rates_Guidance",
    "title": "Local currency saving certificates",
    "url": "https://www.nbe.com.eg/NBE/E/#/EN/ProductCategory?inParams={\"CategoryID\":\"CertificatesID\"}",
    "language": "en",
    "content": "Reviewed reference for the local-currency saving certificates page. Yield figures and conditions must come from the latest retrieved official document; no figure may be stated unless it appears explicitly in that source.",
    "metadata": {
      "source": "curated_document",
      "is_stub": true,
      "curated_version": "2026-08-17.1",
      "reviewed_at": "2026-08-17",
      "valid_until": "2026-09-17",
      "status": "approved",
      "doc_type": "certificate_rate",
      "category": "certificates"
    }
  }
]
